product_url,product_name,price,rating,no_of_reviews,manufacturer,ASIN,description,product description
https://www.amazon.in/ADISA-Casual-Backpack-School-College/dp/B0BX3QFVSM/ref=sr_1_73?crid=2M096C61O4MLT&keywords=bags&qid=1685153239&sprefix=ba%2Caps%2C283&sr=8-73,ADISA 31 Ltrs Casual Backpack School College Bag Pack (Navy Blue) ,Rs.399,3.8 out of 5 stars,35,ADISA,B0BX3QFVSM,ADISA 31 Ltrs Casual Backpack School College Bag Pack (Navy Blue),"['Material: Water Resistant Light-Weight Polyester', 'Compartments: 2 (padded) + 1 front easy-access pocket', 'Laptop Size : 15.6 inches and below (Bigger than 15.6 inches not recommended)', 'Dimensions: LxWxH- 31 x 20 x 47 cms', 'Adjustable Padded Shoulder straps / 2 Bottle holders / Padded Top-handle / Reflector Logo']"
https://www.amazon.in/Kore-K-REGULAR-GYM-BAG-Regular-Gym-Bag/dp/B09VLK27NF/ref=sr_1_74?crid=2M096C61O4MLT&keywords=bags&qid=1685153239&sprefix=ba%2Caps%2C283&sr=8-74,Kore Regular Gym Bag ,Rs.59,2.6 out of 5 stars,"1,746",Kore,B09VLK27NF,Kore Regular Gym Bag,"['This lightweight gym bag will stylishly carry your workout clothes and other essentials from your home to gym sport', 'This is the perfect value bag intended use for athletic, gym, travel, camping, hiking, weekend and carry on or overnight as it is spacious as well as functional', ""With a perfect combination of style and durability, you just can't go wrong with this bag""]"
https://www.amazon.in/sspa/click?ie=UTF8&spc=MTo3MjIzODMzMTk0NDgxMjE5OjE2ODUxNTMyMzk6c3BfbXRmOjIwMTQ2NTkyODQyMjk4OjowOjo&url=%2FHalf-Moon-Resistant-Backpack-Compartment%2Fdp%2FB09T2TCSW7%2Fref%3Dsr_1_75_sspa%3Fcrid%3D2M096C61O4MLT%26keywords%3Dbags%26qid%3D1685153239%26sprefix%3Dba%252Caps%252C283%26sr%3D8-75-spons%26sp_csd%3Dd2lkZ2V0TmFtZT1zcF9tdGY%26psc%3D1,Half Moon 34 L Water Resistant 15.6 inch Laptop Bag/Backpack for Men Women Boys Girls/Office School College with Padded Laptop Compartment (Grey) ,Rs.599,3.9 out of 5 stars,"1,295",Half Moon,B09T2TCSW7,Half Moon 34 L Water Resistant 15.6 inch Laptop Bag/Backpack for Men Women Boys Girls/Office School College with Padded Laptop Compartment (Grey),"['SPACIOUS AND LIGHTWEIGHT: Light weight & spacious laptop bag for men comes with 3 compartments. One is for carrying laptop inside (Upto 17""), with padding for safety, and space for laptop accessories like charger, etc. Second compartment of office bag for men is for books, files & all your day to day essentials. And third compartment of backpack for men is for your extra stuff. Laptop backpacks for men has provision for holding bottles on both sides & has padded shoulder straps for your comfort', 'COMFORT WITH QUALITY: This backpack for men has Wide, Padded & Adjustable shoulder straps & Padded Back for comfort in carrying heavy items. The laptop bag for men is stitched properly & Bartacks on every pressure point for extra durability. The office bag for men are made with strong yet light weight polyester fabric with heavy zippers. College Bags for men also comes with a Rain cover so that you can travel during rainy season without any problem. This laptop bag can be used by everyone.', 'SMART & TRENDY LOOKS: This Large backpack for men is smart, trendy and stylish in looks. The multipurpose college bags for men looks smart, athletic and venturesome and the blend of grey and red makes it appear exquisite. Your hiking trips, mountaineering experience cannot get completed without this amazing trekking backpack. PREMIUM FABRIC : Premium Polyester, Stylish and durable backpack for school /college and travel. Easily accommodate a laptop. Size: 45 cm X 31 cm X 22 cm', 'ENDURING & LONG LASTING: This trekking backpack for men/laptop bag for men is made up of highly durable material, which makes it suitable for all weather conditions including rains & extreme scorching heat. It will not only keep the inside stuff safe but will also resist damage to itself. INTERNAL ORGANISER: This backpack has an Organiser that is small pockets inside the front compartment for holding pens, ID cards, etc. These pockets are very useful in organizing your small day-to-day items.', 'OTHER FEATURES OF LAPTOP BAG FOR MEN: The office bag for men / office bag for women has Rain Cover , Internal Organiser, Adjustable Shoulder Handles (Straps) , 2 Bottle/Umbrella holders , Padded Handle , Padded Laptop Compartment , Reflector Logo.']"
https://www.amazon.in/sspa/click?ie=UTF8&spc=MTo3MjIzODMzMTk0NDgxMjE5OjE2ODUxNTMyMzk6c3BfbXRmOjIwMTQ2NTkyODM2MTk4OjowOjo&url=%2FHalf-Moon-Laptop-Bag-Compartment%2Fdp%2FB0C1NZLF67%2Fref%3Dsr_1_76_sspa%3Fcrid%3D2M096C61O4MLT%26keywords%3Dbags%26qid%3D1685153239%26sprefix%3Dba%252Caps%252C283%26sr%3D8-76-spons%26sp_csd%3Dd2lkZ2V0TmFtZT1zcF9tdGY%26psc%3D1,Half Moon Valex Unisex School Bag/Laptop Backpack/College Bagpack/Office Back Packed | Laptop Bag for Men & Women | School Bags for Boys & Girls with Small Pockets & Laptop Compartment ,Rs.549,4.4 out of 5 stars,16,Half Moon,B0C1NZLF67,Half Moon Valex Unisex School Bag/Laptop Backpack/College Bagpack/Office Back Packed | Laptop Bag for Men & Women | School Bags for Boys & Girls with Small Pockets & Laptop Compartment,"[""Trendy Design: The Laptop bag for men features a unique, trendy design that makes it stand out from other laptop backpacks. It's perfect for individuals who want to express their style while carrying their laptop."", ""Secure Laptop Compartment: The 17-inch padded compartment in laptop backpack for men / Laptop bag for men provides secure storage for your device. The padding ensures that your laptop is protected from scratches and bumps while you're on the move."", ""Front Pockets: The small pockets in College Bags for men / College bag for women in Second Compartment provide easy access to smaller items like your phone, wallet, and keys. These pockets are convenient and ensure that you don't have to dig through the main compartment to find what you need."", 'Strong Built: The Laptop bag for men is built with strong zippers and stitching that can withstand daily wear and tear. This ensures that your belongings are kept safe and secure in college bag for girls and the backpack for men can hold up to daily use.', ""Comfortable to Wear: The Laptop bag for men / backpack for men is designed for maximum comfort. The padded shoulder straps and back panel provide added comfort, reducing strain on your back and shoulders while carrying the laptop backpack. This makes it easy to wear the backpack for extended periods of time, whether you're commuting to work or school or going on a trip.""]"
https://www.amazon.in/ADISA-Laptop-Backpack-Office-College/dp/B0BXQZ6Q85/ref=sr_1_77?crid=2M096C61O4MLT&keywords=bags&qid=1685153239&sprefix=ba%2Caps%2C283&sr=8-77,ADISA Large Laptop Backpack Office Bag College Travel Back Pack with USB (Black) ,Rs.499,4.0 out of 5 stars,39,ADISA,B0BXQZ6Q85,ADISA Large Laptop Backpack Office Bag College Travel Back Pack with USB (Black),"['Material: High Quality Polyester', '1 large compartment and 1 easy-access pocket', 'Laptop Size: 15.6 inch and below', 'Dimensions: LxWxH - 12 x 4.5 x 17 inches', 'USB / Reflector Logo / Adjustable Padded Shoulder Straps / Bottle holder / Padded Top Handle']"
https://www.amazon.in/Safari-Spartan-Water-Resistant-Backpack/dp/B09B277CR5/ref=sr_1_78?crid=2M096C61O4MLT&keywords=bags&qid=1685153239&sprefix=ba%2Caps%2C283&sr=8-78,"Safari Spartan 21 Ltrs Water Resistant Backpack - Teal, S (SPARTAN19CBTEA) ",Rs.599,3.8 out of 5 stars,767,Safari,B09B277CR5,"Safari Spartan 21 Ltrs Water Resistant Backpack - Teal, S (SPARTAN19CBTEA)","['Lightweight yet durable backpack/daypack for school use or everyday outings', 'Front storage pocket keeps smaller items neatly organized and easy to access', 'Mesh pockets on both sides to accommodate your water bottle and umbrella', 'Mesh Padding on back & shoulder strap to provide comfort & better back support; 1-year International Warranty against manufacturing defects', 'Age Range Description: Adult; Closure Type: Zipper; Lining Description: Polyester']"
https://www.amazon.in/Backpack-Business-Scratch-resistant-Multiple-Comfortable/dp/B0B6FNPN76/ref=sr_1_79?crid=2M096C61O4MLT&keywords=bags&qid=1685153239&sprefix=ba%2Caps%2C283&sr=8-79,Arctic Hunter Backpack Premium Business Backpack for Men Office Travel Laptop Bag with 15.6 Inch Laptop Pocket Water/Scratch-resistant Multiple Pocket Padded College Backpack for Men ,"Rs.5,699",4.3 out of 5 stars,99,ah arctic hunter,B0B6FNPN76,Arctic Hunter Backpack Premium Business Backpack for Men Office Travel Laptop Bag with 15.6 Inch Laptop Pocket Water/Scratch-resistant Multiple Pocket Padded College Backpack for Men,"['[Multiple Pocket] -- Arctic Hunter original bag,100% guarantee,two-year warranty.6 zipper pockets store your items.2 front pockets+1 main pocket+1 laptop compartment+2 side pockets.the two front zipper pockets can store small and frequently used items.the main pocket is used for storing cloth,built in a X bucket to hold your clothing and an anti-theft zipper pocket.the laptop compartments have a 15.6 laptop pocket+a ipad pocket,the two pocket is very thick to protect your laptop and ipad.', ""[High quality premium business backpack]-- The Main body of this backpack made by 1680D Nylon fabric,so it's outstanding durable and breathable.the inside made by hiking bag polyester,which make it's abrasion and scratch resistant.the all zipper head is made of high quality metal.laptop and ipad pockets made by high-density foam for shockproof.these material make sure you can use it for a long time and can be a premium business backpack for you."", '[Ergonomic travel bag]-- This backpack adopts with Ergonomic+Comfortable design.1) Microfiber Leather handle make you comfortable hold this backpack.2) The running shoe material back pad is more breathable.3) Strap that secure this backpack to the trolley trunk can free your hands and back.4) Water resistant material protect your items.5) The shoulder strap is thickness and made of running shoe material.6) Made by high quality material make sure load large weight for a long time.', '[Outstanding backpack for laptop]--This arctic hunter bag have a different design,have a zipper compartment for laptop and ipad.this compartment built-in high-density foam to outstanding protect your laptop/ipad.and it can put into 2 laptops.this laptop compartment is not at main compartment,which make the main compartment store more clothing.so this design is very nice and More suitable as a laptop bag.', ""[Great value for money]-- This arctic hunter backpack is very nice for travel,business,school.this meterial and production exceed this price.don't worry it is not worth and it is a great present for birthday,Valentine's day,Father's day,Diwali,Christmas,The New Year.""]"
https://www.amazon.in/BennettTM-Mystic-Shoulder-Messenger-Repellent/dp/B09321GJXZ/ref=sr_1_80?crid=2M096C61O4MLT&keywords=bags&qid=1685153239&sprefix=ba%2Caps%2C283&sr=8-80,Bennett? Mystic 15.6 inch (39.6cm) Laptop Briefcase Shoulder Sling Office Business Professional Travel Messenger Bag for Men and Women Water Repellent Formal Executive Bags (Grey) 6 Months Warranty ,Rs.499,4.0 out of 5 stars,"5,751",Bennett,B09321GJXZ,Bennett™ Mystic 15.6 inch (39.6cm) Laptop Briefcase Shoulder Sling Office Business Professional Travel Messenger Bag for Men and Women Water Repellent Formal Executive Bags (Grey) 6 Months Warranty,"['PREMIUM QUALITY MATERIAL: This laptop computer briefcase is made of high-quality water repellent fabric, and well-made of foam pad inside. The laptop briefcase equipped with a removable shoulder strap and a soft carry handle, you can easily switch the carry way you want.', 'LIGHTWEIGHT AND MULTIFUNCTIONAL: It provide a removable shoulder strap, can be use as shoulder bag or handbag base on your need; top handle strap, and comes with adjustable strap with. It will be a good partner for your daily use or business trip.', 'EXCELLENT DETAILS: The laptop bag with exquisite zippers, durable hook of strap and soft handle, which make it more comfortable to carry and use. Ensure a secure and long-lasting usage everyday as office work bag, travel laptop briefcase, business laptop case, college laptop bag.', 'DIMENSION: External: 16 x 12 x 3 inch; Dimension: 16.5 x 11.5 x 2.5 inch. Suitable for 14-15.6 inch: Dell, Acer, ASUS, Samsung, HP and other brand laptops.(Please allow a little size different because of manual measurement). Great gifts choice for birthday, work anniversary.', ""BENNETT Warranty: Exchange within (6 months) if you don't like. If any problems, please do not hesitate to contact us. We will provide the best solution for you.""]"
https://www.amazon.in/Boldfit-Travel-Accessories-Purse-Mobile/dp/B0BJZQ3ZR9/ref=sr_1_81?crid=2M096C61O4MLT&keywords=bags&qid=1685153239&sprefix=ba%2Caps%2C283&sr=8-81,Boldfit Waist Bag for Men Travel Bag for Men Chest Bag for Men Travel Fanny Pack for Men Waist Bag for Women Side Bag for Men Travel Accessories/Pouch/Hand Purse. Mobile Bag/Money Bag - Black ,Rs.299,4.4 out of 5 stars,628,Boldfit,B0BJZQ3ZR9,Boldfit Waist Bag for Men Travel Bag for Men Chest Bag for Men Travel Fanny Pack for Men Waist Bag for Women Side Bag for Men Travel Accessories/Pouch/Hand Purse. Mobile Bag/Money Bag - Black,"['CHEST BAG FOR MEN: Best Gifts for Women Men, Enjoy Various Activities and Festival Hands-Free. The Fanny Pack for women is perfect for most people carry the most needed items, include phone, passport, keys, ID and other small items.', 'LARGE CAPACITY & CONVENIENT: Our travel fanny packs is well constructed with 3 separate pockets, ideal to organize your essentials separately.', 'MUTI-FUNCTIONAL: Our waist pouch for men is lightweight comfortable waist bag perfect for shopping, travelling, festivals, at theme parks, Great for jogging, dog walking, cycling, hiking and other outdoor activities.', 'DURABLE MATERIAL: Waist bag for men made of best fabric, the fanny pack for men is sturdy and long-lasting usage. Our chest bag for women have smooth zippers ensure users to have quick access to the items.', 'ADJUSTABLE STRAP: Adjustable nylon strap fits for all waist size, making the bum bag ideal for men, women and teenagers. can be carried like a pouch bag for men, crossbody bag, shoulder bag or a small sling chest bag.']"
https://www.amazon.in/Wesley-Milestone-Waterproof-Backpack-Business/dp/B07NJRPJ6Q/ref=sr_1_82?crid=2M096C61O4MLT&keywords=bags&qid=1685153239&sprefix=ba%2Caps%2C283&sr=8-82,Wesley Milestone 15.6 inch 25 L Casual Waterproof Laptop Backpack/Office Bag/School Bag/College Bag/Business Bag/Unisex Travel Backpack (Black) ,Rs.497,4.3 out of 5 stars,"12,766",Wesley,B07NJRPJ6Q,Wesley Milestone 15.6 inch 25 L Casual Waterproof Laptop Backpack/Office Bag/School Bag/College Bag/Business Bag/Unisex Travel Backpack (Black),"['Pattern Type : Pure Color || Closure Type : Zipper || Gender : Unisex', 'Material : Snow Yarn Polyester Fabric || Handle/Strap Type : Soft Handle/Adjustable Shoulder Straps', 'Dimensions : 12.5 * 18 Inch || Capacity : 25 Litre || Fit for 15.6 Inch Laptops/Notebooks', 'Two Side Water Bottle Pockets || One Main Compartment And A Front Pocket', 'Eco-friendly, Durable, Lightweight, Flexible And Water-Resistant Material Helps To Keep The Interior Dry']"
https://www.amazon.in/HEROZ-Backpack-Resistant-Durable-Notebook/dp/B09B7KC93T/ref=sr_1_83?crid=2M096C61O4MLT&keywords=bags&qid=1685153239&sprefix=ba%2Caps%2C283&sr=8-83,HEROZ Hammer Unisex Nylon 35 L Travel Laptop Backpack Water Resistant Slim Durable Fits Up to 17.3 Inch Laptop Notebook (Black) ,"Rs.1,199",4.2 out of 5 stars,"1,130",HEROZ,B09B7KC93T,HEROZ Hammer Unisex Nylon 35 L Travel Laptop Backpack Water Resistant Slim Durable Fits Up to 17.3 Inch Laptop Notebook (Black),"['Style Name: Travel Backpacks; Closure Type: Zipper<br>; Closure Type: Zipper; Style Name: Travel Backpacks<br>', 'Pattern Name: Solid; Age Range Description: Adult; Warranty Description: 1 Year Manufecturing Warrenty; Compartment Description: Up To 16 Inches<br>']"
https://www.amazon.in/FATMUG-Laptop-Bag-Men-Convertible/dp/B084LFX8ZZ/ref=sr_1_84?crid=2M096C61O4MLT&keywords=bags&qid=1685153239&sprefix=ba%2Caps%2C283&sr=8-84,FATMUG Laptop Bag For Men - Convertible Backpack For Office And Travel (Light Grey Oxford Fabric) ,"Rs.1,499",4.4 out of 5 stars,"1,920",FATMUG,B084LFX8ZZ,FATMUG Laptop Bag For Men - Convertible Backpack For Office And Travel (Light Grey Oxford Fabric),"['PRACTICAL AND ELEGANT:Made with Oxford Fabric, a stylish laptop bag for daily travel and short trips<br>; Age Range Description: Adult; Special Features: Laptop Compartment; Pocket Description: Utility Pocket; Style Name: Travel Backpacks<br><br>', 'Style Name: Travel Backpacks; Pocket Description: Utility Pocket; Special Features: Laptop Compartment; Age Range Description: Adult<br>', 'Compartment Description: Greater Than 17 Inches; Water Resistance Level: Water Resistant<br>']"
https://www.amazon.in/sspa/click?ie=UTF8&spc=MTo3MjIzODMzMTk0NDgxMjE5OjE2ODUxNTMyMzk6c3BfYnRmOjIwMTE2ODc5MTY5OTk4OjowOjo&url=%2FRed-Lemon-Multifunctional-Waterproof-Anti-Thief%2Fdp%2FB0B12VF374%2Fref%3Dsr_1_85_sspa%3Fcrid%3D2M096C61O4MLT%26keywords%3Dbags%26qid%3D1685153239%26sprefix%3Dba%252Caps%252C283%26sr%3D8-85-spons%26sp_csd%3Dd2lkZ2V0TmFtZT1zcF9idGY%26psc%3D1,Red Lemon BANGE Multifunctional Waterproof Anti-Thief Sling Bag with USB Charging (Blue) ,"Rs.1,899",4.3 out of 5 stars,146,Red Lemon,B0B12VF374,Red Lemon BANGE Multifunctional Waterproof Anti-Thief Sling Bag with USB Charging (Blue),"['➧ PREMIUM MATERIAL: This multifunctional sling bag is made of high quality water resistant and scratchproof polyester material. The hardware such as zippers, pullers are wear resistant, smooth, of premium quality and durable.', '➧CONVENIENT STORAGE: Graceful curved design with a professional look and pure texture. A well arranged spaced compartment with soft sleeve to carry a Tablet, iPad. Spacious enough to store office accesories, mobile, charger, headphones, pens,wallet etc. One hidden pocket at the side to fit waterbottle or folding umbrella. Back pocket to hold money, cards, wallet. Adjustable shoulder straps for better handling. Hidden cards pocket on the strap. Comfortable sturdy handle to easy carry.', '➧ ANTI- THEFT LOCK: A built-in anti theft password lock for added level of security.', '➧ USB FEATURE : External USB port with built-in charging cable enables convenient charging by connecting your power bank with your electronic devices.', '➧ SIZE & COMFORT : Dimensions: 18cms x 10 cms x 34 cms (LxWxH). Capacity: 6 Lit Weight : 0.46 Kg. This single shoulder unisex sling bag is perfect to be carried for travel and office. Honeycomb anti sweat design for better air permeability. Ergonomics design with soft padding for maximum back support.']"
https://www.amazon.in/sspa/click?ie=UTF8&spc=MTo3MjIzODMzMTk0NDgxMjE5OjE2ODUxNTMyMzk6c3BfYnRmOjIwMTQ2NTkyODM4MTk4OjowOjo&url=%2FHalf-Moon-Travelling-Rucksack-Compartment%2Fdp%2FB09WDBPVFW%2Fref%3Dsr_1_86_sspa%3Fcrid%3D2M096C61O4MLT%26keywords%3Dbags%26qid%3D1685153239%26sprefix%3Dba%252Caps%252C283%26sr%3D8-86-spons%26sp_csd%3Dd2lkZ2V0TmFtZT1zcF9idGY%26psc%3D1,Half Moon 55 litres Travelling Laptop Bag/Rucksack Backpack for Luggage Travel Journey Trekking Hiking Bags for Men Women Boys and Girls with Laptop Compartment & Rain Cover ,Rs.899,4.0 out of 5 stars,433,Half Moon,B09WDBPVFW,Half Moon 55 litres Travelling Laptop Bag/Rucksack Backpack for Luggage Travel Journey Trekking Hiking Bags for Men Women Boys and Girls with Laptop Compartment & Rain Cover,"['ROOMY ENOUGH BACKPACK FOR MEN: This laptop bag for men is ultra lightweight comes with three main compartment having the capacity of approx 55 Ltr, big enough to carry laptop of all sizes, books, clothes, camping gear; 4 main compartments to store all your essentials and 1 small front pocket to carry small accessories. It also features an Internal Organiser(small pockets inside a office bag for men / office bag for women).', 'COMFORT WITH QUALITY: This backpack for men has wide, padded and adjustable shoulder straps and padded back for comfort in carrying heavy items. The College Bags for men is stitched properly and Bartacks on every pressure point for extra durability. The backpack for men is made with strong yet light weight polyester fabric with heavy zippers. The laptop bag for men also comes with a Rain cover so that you can travel during rainy season without any problem.', ""PROUDLY MADE IN INDIA: Half Moon laptop bag for men is proud to be an Indian Brand. We understand the importance of Indian manufacturing and supply chains. It is the time when we revive local industries that's why this college bags for men is Made in India by Indians using Indian materials."", 'QUALITY OF BACKPACK FOR MEN: A major problem in many rucksack/office bag for men is that it get torn between your journey but this Rucksack is strong enough to hold even the heaviest of your items without any problem. It is made up of a strong polyester material, is stitched properly, and is bartacked on every pressure points for extra strength.', 'OTHER FEATURES OF LAPTOP BAG FOR MEN: The office bag for men / office bag for women has Rain Cover, Internal Organiser(Small Pockets), Strong and durable zippers, Adjustable Shoulder Handles (Straps) , 2 Bottle/Umbrella holders , Padded Handle , Padded Laptop Compartment , Ergonomic Design, Reflector Logo, etc.']"
https://www.amazon.in/sspa/click?ie=UTF8&spc=MTo1NjQ1MjExNjM2NTE4NDMzOjE2ODUxNTM0MTU6c3BfYXRmX25leHQ6MjAxNTYxNjU5ODkyOTg6OjA6Og&url=%2FSwiss-Military-Travel-Backpack-Hardshell%2Fdp%2FB0C3MH4NDY%2Fref%3Dsr_1_81_sspa%3Fcrid%3D2M096C61O4MLT%26keywords%3Dbags%26qid%3D1685153415%26sprefix%3Dba%252Caps%252C283%26sr%3D8-81-spons%26sp_csd%3Dd2lkZ2V0TmFtZT1zcF9hdGZfbmV4dA%26psc%3D1%26smid%3DA9XP90DC1X0F8,"Swiss Military Hard Shell Travel Backpack UFO, Alien Series Dimond Cut ABS Hardshell upto 15.6 Inch Laptop ","Rs.3,899",,,Swiss Military,B0C3MH4NDY,"Swiss Military Hard Shell Travel Backpack UFO, Alien Series Dimond Cut ABS Hardshell upto 15.6 Inch Laptop","['Care Instructions: Wipe with Dry Cloth', 'Unique Diamond Cut ABS Hard-shell Design. Accommodates Upto 15.6"" Laptop.', 'Kissing Zip Pullers for Locking Mechanism. Separate Compartment for IPad / Notebook.', 'Velcro Flap to Prevent 180° Opening. Elasticated File / Documents Holder. 180° Opening for Packing / Unpacking Ease. Separate Mesh Zipper Pocket for Accessories.', 'Spacious Garments / Files Pocket for Overnight Travel. Miscellaneous Storage pockets for organizing ease.', 'Premium Padded Back Mesh Panel for Extra Comfort. Adjustable Shoulder Strap for Comfort Fit. Comfort Grip Carrying Handle.']"
https://www.amazon.in/sspa/click?ie=UTF8&spc=MTo1NjQ1MjExNjM2NTE4NDMzOjE2ODUxNTM0MTU6c3BfYXRmX25leHQ6MjAwNzY4OTg5MTg1OTg6OjA6Og&url=%2FSTRABO-Womens-Lightweight-Backpacks-Stylish%2Fdp%2FB0B7FHWY4M%2Fref%3Dsr_1_82_sspa%3Fcrid%3D2M096C61O4MLT%26keywords%3Dbags%26qid%3D1685153415%26sprefix%3Dba%252Caps%252C283%26sr%3D8-82-spons%26sp_csd%3Dd2lkZ2V0TmFtZT1zcF9hdGZfbmV4dA%26psc%3D1,STRABO Stark Lightweight Laptop Bags Backpacks for Boys Girls Stylish Men and Women Casual 15.6 inch 32 L Travel Laptop Bag College Office School ,"Rs.1,429",4.4 out of 5 stars,35,STRABO,B0B7FHWY4M,STRABO Stark Lightweight Laptop Bags Backpacks for Boys Girls Stylish Men and Women Casual 15.6 inch 32 L Travel Laptop Bag College Office School,"['Care Instructions: Hand Wash Only', 'Made of Canvas look a like Premium Heathered PU coated Polyester Fabric With 35 Litres Capacity <br>', 'Casual Laptop Backpack with a color for everyone’s taste. Can fit all 15 inch laptops. <br>', 'Two Main compartments with a laptop sleeve , Two front compartment with an Pen-Pocket/organiser , Two side pockets with a bottle holding elastic , Padded Ergonomic Shoulder Straps and cushioned back. <br>', 'High Quality Nylon Threads and Polyester tapes , All YKK Zippers.; 1 Year warranty against all manufacturing defects. <br>', 'Style Name: Classic; Pattern Name: Solid; Age Range Description: Adult; Pocket Description: Utility Pocket <br>']"
https://www.amazon.in/ADISA-Women-Girls-Floral-SL5072-CRE_Cream/dp/B09B56BCXR/ref=sr_1_83?crid=2M096C61O4MLT&keywords=bags&qid=1685153415&sprefix=ba%2Caps%2C283&sr=8-83,ADISA Women Girls Floral Print Sling Bag ,Rs.495,4.3 out of 5 stars,512,ADISA,B09B56BCXR,ADISA Women Girls Floral Print Sling Bag,"['No of Compartments: 2', 'No of Pockets: 1', 'Closure: Magnetic', 'Dimensions: LxWxH - 7.25 x 3 x 5.75 inches']"
https://www.amazon.in/Nivia-Deflate-5180BK-Polyester-Round/dp/B07222KX3S/ref=sr_1_84?crid=2M096C61O4MLT&keywords=bags&qid=1685153415&sprefix=ba%2Caps%2C283&sr=8-84,NIVIA Deflate Round 01 Polyester Gym Bag/Unisex Gym Bags/Adjustable Shoulder Bag for Men/Duffle Gym Bags for Men/Carry Gym Accessories/Fitness Bag/Sports &Travel Bag/Gym kit Bag ,Rs.369,4.2 out of 5 stars,"7,547",Nivia,B07222KX3S,NIVIA Deflate Round 01 Polyester Gym Bag/Unisex Gym Bags/Adjustable Shoulder Bag for Men/Duffle Gym Bags for Men/Carry Gym Accessories/Fitness Bag/Sports &Travel Bag/Gym kit Bag,"['Strong stitching at major stress points provide long-lasting durability against daily activities', 'Main compartment with zip closure', ""Lightweight and fold-able, It's easy to fold up into small compact space."", 'Can be folded and inserted in the inner pocket with double sided runner', 'Optimum quality of accessories and zipper for smoother functioning and high durability']"
