product_url,product_name,price,rating,no_of_reviews,manufacturer,ASIN,description,product description
https://www.amazon.in/sspa/click?ie=UTF8&spc=MTo1OTgxNjUwMjUyNTY4MzQzOjE2ODUxNTExNTA6c3BfYXRmOjIwMTU2MTY1OTg5Mzk4OjowOjo&url=%2FSwiss-Military-Travel-Backpack-Hardshell%2Fdp%2FB0C3MHG797%2Fref%3Dsr_1_1_sspa%3Fcrid%3D2M096C61O4MLT%26keywords%3Dbags%26qid%3D1685151150%26sprefix%3Dba%252Caps%252C283%26sr%3D8-1-spons%26sp_csd%3Dd2lkZ2V0TmFtZT1zcF9hdGY%26psc%3D1%26smid%3DA9XP90DC1X0F8,"Swiss Military Hard Shell Travel Backpack UFO, Alien Series Dimond Cut ABS Hardshell upto 15.6 Inch Laptop ","Rs.3,899",,,Swiss Military,B0C3MHG797,"Swiss Military Hard Shell Travel Backpack UFO, Alien Series Dimond Cut ABS Hardshell upto 15.6 Inch Laptop","['Care Instructions: Wipe with Dry Cloth', 'Unique Diamond Cut ABS Hard-shell Design. Accommodates Upto 15.6"" Laptop.', 'Kissing Zip Pullers for Locking Mechanism. Separate Compartment for IPad / Notebook.', 'Velcro Flap to Prevent 180° Opening. Elasticated File / Documents Holder. 180° Opening for Packing / Unpacking Ease. Separate Mesh Zipper Pocket for Accessories.', 'Spacious Garments / Files Pocket for Overnight Travel. Miscellaneous Storage pockets for organizing ease.', 'Premium Padded Back Mesh Panel for Extra Comfort. Adjustable Shoulder Strap for Comfort Fit. Comfort Grip Carrying Handle.']"
https://www.amazon.in/sspa/click?ie=UTF8&spc=MTo1OTgxNjUwMjUyNTY4MzQzOjE2ODUxNTExNTA6c3BfYXRmOjIwMTU5Njk3MzQxNDk4OjowOjo&url=%2FElegant-Leatherette-Waterproof-Backpack-Business%2Fdp%2FB0C4PS5JSM%2Fref%3Dsr_1_2_sspa%3Fcrid%3D2M096C61O4MLT%26keywords%3Dbags%26qid%3D1685151150%26sprefix%3Dba%252Caps%252C283%26sr%3D8-2-spons%26sp_csd%3Dd2lkZ2V0TmFtZT1zcF9hdGY%26psc%3D1,Elegant Sport Leatherette (16 inch 28 L Casual Waterproof Laptop Backpack/Office Bag/School Bag/College Bag/Business Bag/Unisex Travel Backpack (Black/Green) ,Rs.699,,,Elegant,B0C4PS5JSM,Elegant Sport Leatherette (16 inch 28 L Casual Waterproof Laptop Backpack/Office Bag/School Bag/College Bag/Business Bag/Unisex Travel Backpack (Black/Green),"['Dimensions and Capacity]: (48 Cm X 33 Cm X 28 CM) 28 Liters. Compatible upto 16\xa0Inches\xa0Laptop.', 'Easy Access Pockets: A sleek anti-theft pocket on the back as well as 2 pockets on the front side help keep all your belongings comfortably organized.', 'Two Large Compartment: It comes with two large compartments with separate padded laptop compartment with elastic bands to hold the laptop.', 'Ergonomic Design: The backpack features a sleek and ergonomic design with a balanced weight distribution through its straps to reduce the load bearing on your shoulders while the padded ventilated air mesh helps reduce sweat. This makes this backpack a suitable alternative to bulky and unsightly laptop backpacks', 'Waterproof Fabric: The backpack comes with a superior waterproof fabric which helps in keeping your laptop and other important stuff\xa0safe\xa0from\xa0rain']"
https://www.amazon.in/Wesley-Milestone-Waterproof-Backpack-Business/dp/B084JGJ8PF/ref=sr_1_3?crid=2M096C61O4MLT&keywords=bags&qid=1685151150&sprefix=ba%2Caps%2C283&sr=8-3,Wesley Milestone 2.0 Casual Waterproof Laptop Backpack/Office Bag/School Bag/College Bag/Business Bag/Travel Backpack (Dimensions:13x18 inches) (Compatible with 39.62cm(15.6inch laptop) 30 L (Blue & black) ,Rs.598,4.3 out of 5 stars,"10,947",Wesley,B084JGJ8PF,Wesley Milestone 2.0 Casual Waterproof Laptop Backpack/Office Bag/School Bag/College Bag/Business Bag/Travel Backpack (Dimensions:13x18 inches) (Compatible with 39.62cm(15.6inch laptop) 30 L (Blue & black),"['30L Capacity: The Backpack has a padded laptop compartment that can fit 15.6 inch laptop. It can also accommodate essentials such as a Lunch box, Charger, Tablet, Books, Power Bank, Wallet, and Sunglass.', 'Multi-Level Organizer: The backpack has a front zipper pocket for the ID card, Sanitizer, House keys, Pen. First compartment with pockets for the earphones, pens, notebook, Fitness Band. Spacious second compartment for all your electronics.', 'Ergonomic Design: Thick cushioning around the shoulders and on the back panel makes the backpack super light and comfortable on the move. “S” Shaped shoulder strap distribute the weight of the backpack across your upper body.', 'Made In India: Wesley Business Casual Backpack is fully manufactured in India and pass through stringent quality tests and checks', '1 Year Warranty: The Wesley Business casual backpack comes with 1 year of warranty', 'Water Resistant Material: Advanced IPX4 coating on the material ensures resistance to water entering from any direction.']"
https://www.amazon.in/American-Tourister-AMT-SCH-02/dp/B07CJCGM1M/ref=sr_1_4?crid=2M096C61O4MLT&keywords=bags&qid=1685151150&sprefix=ba%2Caps%2C283&sr=8-4,American Tourister 32 Ltrs Black Casual Backpack (AMT FIZZ SCH BAG 02 - BLACK) ,"Rs.1,199",4.0 out of 5 stars,"54,227",American Tourister,B07CJCGM1M,American Tourister 32 Ltrs Black Casual Backpack (AMT FIZZ SCH BAG 02 - BLACK),"['Laptop Compatibility: No, Strap Type: Adjustable, Trolley Support: No. With Rain Cover : No', 'Outer Material: Polyester, Color: Black', 'Water Resistance: Water resistant , not Waterproof', 'Capacity: 32 liters; Dimensions: 31.5 x 22 x 49.5 Centimeters', 'Number of Wheels: 0, Number of compartments: 3', 'Warranty type: Manufacturer; 1 year International warranty valid for 1 year from the original date of', 'Mesh pockets on both sides to accommodate your sipper or bottle and umbrella', 'Mesh Padding on back & shoulder strap to provide comfort & better back support']"
https://www.amazon.in/Skybags-Brat-Black-Casual-Backpack/dp/B08Z1HHHTD/ref=sr_1_5?crid=2M096C61O4MLT&keywords=bags&qid=1685151150&sprefix=ba%2Caps%2C283&sr=8-5,Skybags Brat Black 46 Cms Casual Backpack ,Rs.669,4.1 out of 5 stars,"4,558",Skybags,B08Z1HHHTD,Skybags Brat Black 46 Cms Casual Backpack,"['Combination of functional & safety features in stylish design, Soft mesh back with 8 mm foam padded 2 Main Compartment, 1 Slip In Pocket inside the bag, Printed Design, Mesh bottle holder on the side,', 'Water Resistance Level: Not Water Resistant', 'Size: 35 x 13 x 46 cms']"
https://www.amazon.in/Wesley-Spartan-Hiking-Raincover-Organiser/dp/B098QFF5TJ/ref=sr_1_6?crid=2M096C61O4MLT&keywords=bags&qid=1685151150&sprefix=ba%2Caps%2C283&sr=8-6,Wesley Spartan Unisex Travel Hiking Laptop Bag fits Upto 17.3 inch with Raincover and Internal Organiser Backpack Rucksack College Bag ,Rs.698,4.1 out of 5 stars,"1,279",Wesley,B098QFF5TJ,Wesley Spartan Unisex Travel Hiking Laptop Bag fits Upto 17.3 inch with Raincover and Internal Organiser Backpack Rucksack College Bag,"['Spacious : This Rucksack bag is lightweight and comes with Three main compartment having the capacity of approx 45 Ltr, big enough to carry laptop of all sizes, books, clothes, camping gear; 3 main compartments to store all your essentials, A back mesh pocket to carry extra documents and numerous small pocket to carry all your small accessories', 'CAPACITY & SIZE : 45 Litres; Weight: 0.9 kg ; Dimensions: 22.9cm x 36.8cm x 50.8cm ; Utility : Ideal for Travel, Hiking, Trekking & Camping, Day trip.; HIGH QUALITY : A major problem in many rucksack and travelling bags is that it get torn between your journeys or within a short period of time but this Rucksack which is made from high Quality materials, is stitched properly and has bartacks on pressure points is strong enough to hold all your items without any problem', 'FEATURES : Back Padding, Chest Strap, Earphone Cord Support, Unique Design, Hip Belt, Integrated Rain Cover, Laptop Compartment, Telescope Handle, Water Bottle / Umbrella Pouch, Zip Closure, Padded Handles, Padded Shoulder Strap , Breathable Mesh etc.; Closure Type: Zipper; Age Range Description: Adult', 'COMFORTABLE TRAVEL : Backside Honeycomb padded structure which helps you travelling comfortably all day long, provides proper air circulation while in summer also to prevent you feel more relax. Chest Strap, Hip Belt, Straight Shaped Straps structure which fits on your shoulders very comfortably makes you lift heavy objects easily.', '12 Months Limited Brand Warranty']"
https://www.amazon.in/Number-Backpack-Compartment-Charging-Organizer/dp/B09VTDMRY7/ref=sr_1_7?crid=2M096C61O4MLT&keywords=bags&qid=1685151150&sprefix=ba%2Caps%2C283&sr=8-7,"FUR JADEN Anti Theft Number Lock Backpack Bag with 15.6 Inch Laptop Compartment, USB Charging Port & Organizer Pocket for Men Women Boys Girls ",Rs.699,4.0 out of 5 stars,"4,037",FUR JADEN,B09VTDMRY7,"FUR JADEN Anti Theft Number Lock Backpack Bag with 15.6 Inch Laptop Compartment, USB Charging Port & Organizer Pocket for Men Women Boys Girls","['Care Instructions: Wipe with Damp Cloth', 'Number Lock: This Fur Jaden Anti Theft laptop backpack comes equipped with a Number Lock. This helps keep your laptop and other belongings safe when you need to leave your bag unattended in a public space. The number lock sequence can be changed and customised by your directly.<br>', 'USB Charging Port: Now charge your devices on the go with your new Fur Jaden backpack without the hassle of carrying a bulk power bank in your pocket/ hand at all times.<br>', 'Ergonomic Design: This backpack has been designed to ensure equal weight distribution on your shoulders along with padded shoulder straps and breathable air mesh on the back.<br>', 'Dimension: 42 CM (L) x 30 CM (W) x 18 CM (D). Storage Capacity: 25L. Weight: 600 Grams; Warranty: 1 Year Manufacturer Warranty against Manufacturing Defects<br>', 'Age Range Description: Adult; Closure Type: Zipper; Lining Description: Polyester<br>']"
https://www.amazon.in/ADISA-Laptop-Backpack-Office-College/dp/B09TPX22NF/ref=sr_1_8?crid=2M096C61O4MLT&keywords=bags&qid=1685151150&sprefix=ba%2Caps%2C283&sr=8-8,ADISA 15.6 inch Laptop Backpack Office Bag College Travel Back Pack 32 Ltrs (z-Navy Blue) ,Rs.499,3.9 out of 5 stars,806,ADISA,B09TPX22NF,ADISA 15.6 inch Laptop Backpack Office Bag College Travel Back Pack 32 Ltrs (z-Navy Blue),"['Material: Water Resistant Light-Weight Polyester<br>', 'Compartments: 2 with padding; Laptop Size: 15.6 inch and below<br>', 'Dimensions: LxWxH - 12.5 x 7.5 x 19 inches<br>', 'Reflector Logo / Adjustable Padded Shoulder Straps / 2 Bottle holders<br>', 'Closure Type: Zipper<br>']"
https://www.amazon.in/Half-Moon-Waterproof-Backpack-Students/dp/B085MHDJ93/ref=sr_1_9?crid=2M096C61O4MLT&keywords=bags&qid=1685151150&sprefix=ba%2Caps%2C283&sr=8-9,"Half Moon 35L Water Resistant 15.6 inch Laptop Bag for Men/Backpack for Men, Navy Blue | Office Bag for Men/Office Bag for Women with Padded Laptop Compartment | Rain Cover & Reflective Strips ",Rs.529,3.9 out of 5 stars,"15,936",Half Moon,B085MHDJ93,"Half Moon 35L Water Resistant 15.6 inch Laptop Bag for Men/Backpack for Men, Navy Blue | Office Bag for Men/Office Bag for Women with Padded Laptop Compartment | Rain Cover & Reflective Strips","['SPACIOUS AND LIGHTWEIGHT: Light weight & spacious laptop bag for men comes with 3 compartments. One is for carrying laptop inside (Upto 17""), with padding for safety, and space for laptop accessories like charger, etc. Second compartment of office bag for men is for books, files & all your day to day essentials. And third compartment of backpack for men is for your extra stuff. Laptop backpacks for men has provision for holding bottles on both sides & has padded shoulder straps for your comfort', 'COMFORT WITH QUALITY: This backpack for men has Wide, Padded & Adjustable shoulder straps & Padded Back for comfort in carrying heavy items. The laptop bag for men is stitched properly & Bartacks on every pressure point for extra durability. The office bag for men are made with strong yet light weight polyester fabric with heavy zippers. College Bags for men also comes with a Rain cover so that you can travel during rainy season without any problem. This laptop bag can be used by everyone.', 'SMART & TRENDY LOOKS: This Large backpack for men is smart, trendy and stylish in looks. The multipurpose college bags for men looks smart, athletic and venturesome and the blend of grey and red makes it appear exquisite. Your hiking trips, mountaineering experience cannot get completed without this amazing trekking backpack. PREMIUM FABRIC : Premium Polyester, Stylish and durable backpack for school /college and travel. Easily accommodate a laptop. Size: 45 cm X 31 cm X 22 cm', 'ENDURING & LONG LASTING LAPTOP BACKPACK: This trekking backpack for men/laptop bag for men is made up of highly durable material, which makes it suitable for all weather conditions including rains & extreme scorching heat. It will not only keep the inside stuff safe but will also resist damage to itself. We have designed the bag keeping your comfort in mind. Shoulder has high density padding, with 3D ventilated air foam padding to prevent sweating & to help you lift heavy objects easily.', 'OTHER FEATURES OF LAPTOP BAG FOR MEN: The office bag for men / office bag for women has Strong and durable zippers, Adjustable Shoulder Handles (Straps) , 2 Bottle/Umbrella holders , Padded Handle , Padded Laptop Compartment (can carry laptops of size 13, 14, 15.6 & 17 inches), Reflector Logo.']"
https://www.amazon.in/American-Tourister-BACKPACK-COMPARTMENT-ORGANIZER/dp/B0BTD4FK9G/ref=sr_1_10?crid=2M096C61O4MLT&keywords=bags&qid=1685151150&sprefix=ba%2Caps%2C283&sr=8-10,"American Tourister VALEX BLUE LAPTOP BACKPACK 28 Ltrs,Volume, LAPTOP COMPARTMENT, BOTTLE POCKET, FRONT ORGANIZER ","Rs.1,299",4.2 out of 5 stars,207,American Tourister,B0BTD4FK9G,"American Tourister VALEX BLUE LAPTOP BACKPACK 28 Ltrs,Volume, LAPTOP COMPARTMENT, BOTTLE POCKET, FRONT ORGANIZER","['Care Instructions: Hand Wash Only', 'Well Organized compartment ,Security Back Pocket']"
https://www.amazon.in/sspa/click?ie=UTF8&spc=MTo1OTgxNjUwMjUyNTY4MzQzOjE2ODUxNTExNTA6c3BfbXRmOjIwMTQ2NTkyODM3OTk4OjowOjo&url=%2FHalf-Moon-Trekking-Bags-Compartment%2Fdp%2FB08PSX1LN9%2Fref%3Dsr_1_11_sspa%3Fcrid%3D2M096C61O4MLT%26keywords%3Dbags%26qid%3D1685151150%26sprefix%3Dba%252Caps%252C283%26sr%3D8-11-spons%26sp_csd%3Dd2lkZ2V0TmFtZT1zcF9tdGY%26psc%3D1,Half Moon 45L Hammer Waterproof Laptop Travelling Rucksack Trekking Backpack for Travel Journey bags for Men Women Boys & Girls with 17.3inch Laptop Compartment & Rain cover ,"Rs.1,199",4.1 out of 5 stars,"1,223",Half Moon,B08PSX1LN9,Half Moon 45L Hammer Waterproof Laptop Travelling Rucksack Trekking Backpack for Travel Journey bags for Men Women Boys & Girls with 17.3inch Laptop Compartment & Rain cover,"['ROOMY ENOUGH BACKPACK FOR MEN: This laptop bag for men is ultra lightweight comes with three main compartments having the capacity of approx 45 Ltr, big enough to carry laptop of all sizes, books, clothes, camping gear; 3 main compartments to store all your essentials and 1 small front pocket to carry small accessories. It also features an Internal Organiser (small pockets inside a office bag for men / office bag for women).', 'COMFORTABLE TRAVEL : This backpack for men has Honeycomb padded structure which helps you travelling comfortably all day long, provides proper air circulation while in summer also to prevent you feel more relax. The laptop bag for men comes with Chest Strap, Hip Belt, Straight Shaped Straps structure which fits on your shoulders very comfortably makes you lift heavy objects easily. CAPACITY : 45L; Weight: 0.7kg ; Dimensions: 56x36x25cm ; Utility: Ideal for Travel, Hiking, Trekking & Camping.', 'OTHER FEATURES OF LAPTOP BAG FOR MEN: The office bag for men / office bag for women has Rain Cover, Internal Organiser (Small Pockets), Strong and durable zippers, Adjustable Shoulder Handles (Straps), 2 Bottle/Umbrella holders , Padded Handle , Padded Laptop Compartment , Ergonomic Design, Reflector Logo, etc.', 'QUALITY OF BACKPACK FOR MEN: A major problem in many rucksack/office bag for men is that it get torn between your journey but this laptop bag for men is strong enough to hold even the heaviest of your items without any problem. It is made up of a strong polyester material, is stitched properly, and is bartacked on every pressure point for extra strength.', 'OTHER FEATURES OF LAPTOP BAG FOR MEN: The office bag for men / office bag for women has Back Padding, Chest Strap, Earphone Cord Support, Unique Design, Hip Belt, Integrated Rain Cover, Laptop Compartment, Telescope Handle, Water Bottle / Umbrella Pouch, Zip Closure, Padded Handles, Padded Shoulder Strap, Breathable Mesh etc.']"
https://www.amazon.in/sspa/click?ie=UTF8&spc=MTo1OTgxNjUwMjUyNTY4MzQzOjE2ODUxNTExNTA6c3BfbXRmOjIwMTQ2NTkyODM4MTk4OjowOjo&url=%2FHalf-Moon-Travelling-Rucksack-Compartment%2Fdp%2FB09WDBPVFW%2Fref%3Dsr_1_12_sspa%3Fcrid%3D2M096C61O4MLT%26keywords%3Dbags%26qid%3D1685151150%26sprefix%3Dba%252Caps%252C283%26sr%3D8-12-spons%26sp_csd%3Dd2lkZ2V0TmFtZT1zcF9tdGY%26psc%3D1,Half Moon 55 litres Travelling Laptop Bag/Rucksack Backpack for Luggage Travel Journey Trekking Hiking Bags for Men Women Boys and Girls with Laptop Compartment & Rain Cover ,Rs.899,4.0 out of 5 stars,433,Half Moon,B09WDBPVFW,Half Moon 55 litres Travelling Laptop Bag/Rucksack Backpack for Luggage Travel Journey Trekking Hiking Bags for Men Women Boys and Girls with Laptop Compartment & Rain Cover,"['ROOMY ENOUGH BACKPACK FOR MEN: This laptop bag for men is ultra lightweight comes with three main compartment having the capacity of approx 55 Ltr, big enough to carry laptop of all sizes, books, clothes, camping gear; 4 main compartments to store all your essentials and 1 small front pocket to carry small accessories. It also features an Internal Organiser(small pockets inside a office bag for men / office bag for women).', 'COMFORT WITH QUALITY: This backpack for men has wide, padded and adjustable shoulder straps and padded back for comfort in carrying heavy items. The College Bags for men is stitched properly and Bartacks on every pressure point for extra durability. The backpack for men is made with strong yet light weight polyester fabric with heavy zippers. The laptop bag for men also comes with a Rain cover so that you can travel during rainy season without any problem.', ""PROUDLY MADE IN INDIA: Half Moon laptop bag for men is proud to be an Indian Brand. We understand the importance of Indian manufacturing and supply chains. It is the time when we revive local industries that's why this college bags for men is Made in India by Indians using Indian materials."", 'QUALITY OF BACKPACK FOR MEN: A major problem in many rucksack/office bag for men is that it get torn between your journey but this Rucksack is strong enough to hold even the heaviest of your items without any problem. It is made up of a strong polyester material, is stitched properly, and is bartacked on every pressure points for extra strength.', 'OTHER FEATURES OF LAPTOP BAG FOR MEN: The office bag for men / office bag for women has Rain Cover, Internal Organiser(Small Pockets), Strong and durable zippers, Adjustable Shoulder Handles (Straps) , 2 Bottle/Umbrella holders , Padded Handle , Padded Laptop Compartment , Ergonomic Design, Reflector Logo, etc.']"
https://www.amazon.in/Number-Backpack-Compartment-Charging-Organizer/dp/B09VTCNN75/ref=sr_1_13?crid=2M096C61O4MLT&keywords=bags&qid=1685151150&sprefix=ba%2Caps%2C283&sr=8-13,"FUR JADEN Anti Theft Number Lock Backpack Bag with 15.6 Inch Laptop Compartment, USB Charging Port & Organizer Pocket for Men Women Boys Girls ",Rs.699,4.0 out of 5 stars,"4,037",FUR JADEN,B09VTCNN75,"FUR JADEN Anti Theft Number Lock Backpack Bag with 15.6 Inch Laptop Compartment, USB Charging Port & Organizer Pocket for Men Women Boys Girls","['Care Instructions: Wipe with Damp Cloth', 'Number Lock: This Fur Jaden Anti Theft laptop backpack comes equipped with a Number Lock. This helps keep your laptop and other belongings safe when you need to leave your bag unattended in a public space. The number lock sequence can be changed and customised by your directly.<br>', 'USB Charging Port: Now charge your devices on the go with your new Fur Jaden backpack without the hassle of carrying a bulk power bank in your pocket/ hand at all times.<br>', 'Ergonomic Design: This backpack has been designed to ensure equal weight distribution on your shoulders along with padded shoulder straps and breathable air mesh on the back.<br>', 'Dimension: 42 CM (L) x 30 CM (W) x 18 CM (D). Storage Capacity: 25L. Weight: 600 Grams; Warranty: 1 Year Manufacturer Warranty against Manufacturing Defects<br>', 'Closure Type: Zipper; Lining Description: Polyester; Age Range Description: Adult<br>']"
https://www.amazon.in/FUR-JADEN-Leatherette-Polypropylene-DUFF05/dp/B07M9BRCQ5/ref=sr_1_14?crid=2M096C61O4MLT&keywords=bags&qid=1685151150&sprefix=ba%2Caps%2C283&sr=8-14,Fur Jaden Brown Textured Leatherette Stylish & Spacious Weekender Duffle Bag for Travel ,Rs.899,4.3 out of 5 stars,"5,932",FUR JADEN,B07M9BRCQ5,Fur Jaden Brown Textured Leatherette Stylish & Spacious Weekender Duffle Bag for Travel,"[""MATERIAL - We use Highest Quality of Artificial Leather which is Durable, Long Lasting and tested to ensure they don't peel off in just few months. The leather is also water resistant. Inner fabric lining ensured to have a soft touch feel. We use quality zips and accessories that have a long life."", 'Waterproof - With this unisex duffle bag, you can be rest assured that none of your belongings will be damaged by rain or accidental splashes. The interiors of this water-resistant travel duffle bag remain free from moisture even if you get caught in an unexpected shower.', 'Dimensions: 47 x 28 x 27 CM. Volume Capacity - 35 Litres. Huge Spacious Compartment', 'Design - This stylish yet utilitarian textured leatherette duffle bag can be used for corporate travel as well as to take to the gym. The Large Spacious Compartment is suitable for 3-4 days weekender or business trip, can be used as a carry-on flight bag as well.', 'Warranty - 100% Genuine Fur Jaden Men Bags, 10 days No Question asked replacement guarantee from the date of delivery. 6 Month Manufacturer and Seller Warranty against Manufacturing Defects']"
https://www.amazon.in/American-Tourister-BACKPACK-COMPARTMENT-ORGANIZER/dp/B0BTD4S4XF/ref=sr_1_15?crid=2M096C61O4MLT&keywords=bags&qid=1685151150&sprefix=ba%2Caps%2C283&sr=8-15,"American Tourister VALEX BLACK LAPTOP BACKPACK 28 Ltrs,Volume, LAPTOP COMPARTMENT, BOTTLE POCKET, FRONT ORGANIZER ","Rs.1,299",4.3 out of 5 stars,197,American Tourister,B0BTD4S4XF,"American Tourister VALEX BLACK LAPTOP BACKPACK 28 Ltrs,Volume, LAPTOP COMPARTMENT, BOTTLE POCKET, FRONT ORGANIZER","['Care Instructions: Hand Wash Only', 'Well Organized compartment ,Security Back Pocket']"
https://www.amazon.in/SAFARI-Ltrs-Casual-Backpack-DAYPACKNEO15CBSEB/dp/B07Q7CNPMV/ref=sr_1_16?crid=2M096C61O4MLT&keywords=bags&qid=1685151150&sprefix=ba%2Caps%2C283&sr=8-16,SAFARI 15 Ltrs Sea Blue Casual/School/College Backpack (DAYPACKNEO15CBSEB) ,Rs.248,4.0 out of 5 stars,"19,042",Safari,B07Q7CNPMV,SAFARI 15 Ltrs Sea Blue Casual/School/College Backpack (DAYPACKNEO15CBSEB),"['Outer Material: Polyester, Color: Sea Blue', 'Not water resistant. With Rain Cover:No', 'Capacity: 15 liters; Weight: 200 grams; Dimensions: 12 cms x 27 cms x 41 cms (LxWxH)', 'Number of compartments: 2; Laptop Compatibility: No', 'Age Range Description: Kid; Closure Type: Drawstring; Pocket Description: Utility Pocket', 'Drawstring, 2 Compartments, Compact Size']"
https://www.amazon.in/TRUE-HUMAN-Anti-Theft-backpack-charging/dp/B09QJ7ZF2Y/ref=sr_1_17?crid=2M096C61O4MLT&keywords=bags&qid=1685151150&sprefix=ba%2Caps%2C283&sr=8-17,"TRUE HUMAN Emperor Anti-Theft backpack With USB charging Port Laptop Bag, Office bag, college bag and anti -theft back pocket (Black) ",Rs.599,3.8 out of 5 stars,"2,038",TRUE HUMAN,B09QJ7ZF2Y,"TRUE HUMAN Emperor Anti-Theft backpack With USB charging Port Laptop Bag, Office bag, college bag and anti -theft back pocket (Black)","['Ease of Access-Multi purpose pockets Super sorted stuff It has a vibrant and stylish design, along with the added benefit of spacious interiors.', 'Anti - Theft Pocket-Hidden storage pocket for important documents like passports, tickets, cash while on the go.', 'Integrated Fast charging port-Unique pre-fitted USB port helps you to easily connect your phone or any other device with your power bank. Charging system for smart devices , with free USB (power bank not included )', 'Care Instructions: Wipe with Dry Cloth', 'Superior & Durability: Made of durable and Eco-friendly water resistant oxford textile fabric,which keeps your files and stuffs dry inside. This backpack can hold up to 15.6"" laptop from most brands, but it may not be suitable for all brand 15.6"". Since there maybe exist slight size difference among different laptop brands.']"
