product_url,product_name,price,rating,no_of_reviews,manufacturer,ASIN,description,product description
https://www.amazon.in/Messenger-Water-resistant-Briefcase-Multiple-Men-Black/dp/B0B6G58BYC/ref=sr_1_215?crid=2M096C61O4MLT&keywords=bags&qid=1685155952&sprefix=ba%2Caps%2C283&sr=8-215,"ah arctic hunter Laptop Bag,Messenger Bags For Men And Women Laptop Sling Bag With Handle Water-resistant Laptop Briefcase For 15.6 Inch Laptop Multiple Pockets Travel Office For Men.Black ","Rs.2,849",4.5 out of 5 stars,72,ah arctic hunter,B0B6G58BYC,"ah arctic hunter Laptop Bag,Messenger Bags For Men And Women Laptop Sling Bag With Handle Water-resistant Laptop Briefcase For 15.6 Inch Laptop Multiple Pockets Travel Office For Men.Black","['[Multiple compartments&Large capacity Laptop Bag]-- Multiple compartments make you store your belongings reasonably,take out fastly your items from this handbag.this laptop sling bag is consist of 2 front zipper compartments + 1 laptop compartment +1 anti-theft back compartment.so it is large capacity, can store more items than others. Arctic Hunter original bag, 100% guarantee, two-year warranty.', '[Super protection for your laptop] -- This messenger bag have a 15.6"" laptop pocket, it made by EPE Foam Covered by Velvet For Shock-Proof & Soft skin-friendly.The laptop pocket also is scratch resistant.the laptop bag also have a 11""ipad pocket,the function and material is same with laptop pocket.This bag is water-resistant in four levels to protect your laptop. Arctic Hunter bag is a good companion for your laptop.', '[Two modes for carrying]-- This laptop bag have a Microfiber Leather handle and a detachable/adjustable shoulder strap,so you can freely change the carry mode,as a handbag or a sling bag to use. There are two rubber mats at the bottom, let this bag steady standing.', ""[Nice quality messenger bag/handbag]-- Main body made by 1680D Nylon Fabric for Durable & Breathable.Front Panel made by PU Coated Fabric + Microfiber Leather For Water Resistant & Scratch Resistant.Metal Zipper make sure it's durable and smooth.Arctic Hunter Bag Ensure a Secure & Long-lasting Usage Everyday & Weekend and Travelling."", '[Good to use as a business/travel bag]-- This bag is design with a business style.multiple compartments help you better store office supplies and have a laptop pocket to put in your laptop.thick and breathable shoulder strap and comfortable Microfiber Leather makes it easier for you to carry this bag on the go.and it can be placed firmly on your trunk. Free your hands and shoulder.']"
https://www.amazon.in/BAG-CORNER-Travel-Clothing-Duffel/dp/B0B6VNJ3YG/ref=sr_1_216?crid=2M096C61O4MLT&keywords=bags&qid=1685155952&sprefix=ba%2Caps%2C283&sr=8-216,BAG CORNER Travel Woman and Clothing Duffel Bag (Ten) ,Rs.799,4.1 out of 5 stars,23,BAG CORNER,B0B6VNJ3YG,BAG CORNER Travel Woman and Clothing Duffel Bag (Ten),"['GOOD FABRIC', 'STRONG HANDLE', 'Zipper closure;Durable, Light and soft canvas, top quality genuine leather, Trim stitching handcraf', 'Quality Solid Zinc-alloy Hardware, won’t gather rust easily; Dimensions 42(L) 32(H) 24(W)cm, Large capacity, can be used as a carry-on flight bag', 'Fashion casual life style, General use for Female, Male, Used in the Weekend travel, Daily travel ,Short Business travel, enough room for clothes and traveling necessities', 'Handle Type: Web Handle; Water Resistance Level: Not Water Resistant']"
https://www.amazon.in/Frantic-Soft-Elephant-Velvet-Plush/dp/B07P9JFYZ5/ref=sr_1_217?crid=2M096C61O4MLT&keywords=bags&qid=1685155952&sprefix=ba%2Caps%2C283&sr=8-217,"Frantic Velvet Kids Soft Cartoon Animal Travelling School Bag Soft Plush Backpacks Baby Girls Boys for 2 to 5 Years Baby/Boys/Girls Nursery, Picnic,Preschool ",Rs.279,3.9 out of 5 stars,"5,091",Frantic,B07P9JFYZ5,"Frantic Velvet Kids Soft Cartoon Animal Travelling School Bag Soft Plush Backpacks Baby Girls Boys for 2 to 5 Years Baby/Boys/Girls Nursery, Picnic,Preschool","['DIMENSIONS – 14 Length x 10 Width x 3 Height in inches.; MATERIAL TYPE – high quality washable felt velvet used which is non toxic and soft and skin friendly fabric. Ideal for Preschool / Nursery Kids. <br>', 'FEATURES – Light weight and soft fabric and it come with adjustable shoulder straps, which greatly reduce the pressure to shoulders. Also it has enough space for store things like toys, lunch box, fruits, small books, pencil box and other stationery items. <br>', 'The toddler backpack features with two adjustable shoulder straps and a top handle fit small children of all ages, and allows you to comfortably and easily adjust this backpack to fit boys and girls of different sizes <br>', ""The toddler bag have one small front pocket and a main compartment. You can put some small children's things in it, like Books, small books, pens, etc. Super cute pattern and design will make your small preschool or grade school children excited to head off to school with this bookbag! Also ideal for going to the zoo, playing at the park, traveling and any other outdoor activities <br>"", 'Water Resistance Level: Water Resistant; Color Name: FullBody_Grey_Nick_Elephant']"
https://www.amazon.in/American-Tourister-Polyester-Compartment-Backpack/dp/B0BWFFFT5H/ref=sr_1_218?crid=2M096C61O4MLT&keywords=bags&qid=1685155952&sprefix=ba%2Caps%2C283&sr=8-218,"American Tourister Sest+ Polyester 2 Compartment Unisex Backpack (Grey,Frsz) ","Rs.1,429",4.1 out of 5 stars,9,American Tourister,B0BWFFFT5H,"American Tourister Sest+ Polyester 2 Compartment Unisex Backpack (Grey,Frsz)","['Product Type : Backpacks', 'Material : Polyester', 'Compartment : 2', 'Warranty : 1 year', 'Waterproof : No']"
https://www.amazon.in/sspa/click?ie=UTF8&spc=MTo2MDU1NTUyMzQ2NjE0NjYwOjE2ODUxNTU5NTI6c3BfbXRmOjIwMTYxOTkzMDAzNjk4OjowOjo&url=%2FCLOUDS-GEAR-Laptop-Backpack-Only_Black%2Fdp%2FB0BKXQBTFR%2Fref%3Dsr_1_219_sspa%3Fcrid%3D2M096C61O4MLT%26keywords%3Dbags%26qid%3D1685155952%26sprefix%3Dba%252Caps%252C283%26sr%3D8-219-spons%26sp_csd%3Dd2lkZ2V0TmFtZT1zcF9tdGY%26psc%3D1,CLOUDS GEAR Nika 35 Ltrs Large Laptop Backpack whith 2 Compartment Polyester Trendy Bags (Only_Black) ,"Rs.1,499",,,CLOUDS GEAR,B0BKXQBTFR,CLOUDS GEAR Nika 35 Ltrs Large Laptop Backpack whith 2 Compartment Polyester Trendy Bags (Only_Black),"['Care Instructions: Hand Wash Only', 'Material: High Density Premium Polyester Faric Used, Water Resistance. Dimension: L x W x H (46 x 33 x 20 cm). Capacity: 32-35 Litres', 'USB CHARGING PORT, BURGLARY DESIGN, ANTI THEFT BACKPACK', 'LAPTOP COMPARTMENT. Laptop Compartment with dual zippered access and thick soft foam padding provides extra protection for laptop upto 15.6 inch', 'MAIN COMPARTMENT is very roomy for big items such as books; clothes etc. 2 zippered side pockets are suitable for water bottle, compact umbrella. A ideal small pocket on the top for glasses, keys etc', 'HIGH ELASTICITY BREATHABLE BACK PAD. Reflective material in front for safety warning. 12 months warranty']"
https://www.amazon.in/sspa/click?ie=UTF8&spc=MTo2MDU1NTUyMzQ2NjE0NjYwOjE2ODUxNTU5NTI6c3BfbXRmOjIwMTA2Njc2MjMyNTk4OjowOjo&url=%2FPolice-Polyester-Laptop-Spec-Backpack%2Fdp%2FB07ZB8NWTZ%2Fref%3Dsr_1_220_sspa%3Fcrid%3D2M096C61O4MLT%26keywords%3Dbags%26qid%3D1685155952%26sprefix%3Dba%252Caps%252C283%26sr%3D8-220-spons%26sp_csd%3Dd2lkZ2V0TmFtZT1zcF9tdGY%26psc%3D1,POLICE Polyester 35 Ltr Laptop Big Low Spec Laptop Backpack - Black/Navy ,"Rs.1,569",3.3 out of 5 stars,202,POLICE,B07ZB8NWTZ,POLICE Polyester 35 Ltr Laptop Big Low Spec Laptop Backpack - Black/Navy,"['Care Instructions: Dry Clean Only', 'PRODUCT FEATURES: It is Lightweight and comfortable to carry with adjustable padded straps. This Backpack has decent capacity to store essentials with inside zipper pockets to put your private or valuable items. It also has Zipper closure for handy access. It is perfect for business, travelling, meeting, shopping and daily use.<br>', 'CRAFTSMANSHIP: Each Police backpack is aesthetically designed and hand crafted by expert smiths to ensure consistent superior quality and high value for customers.<br>', 'LAPTOP COMPARTMENT: Include Padded laptop compartment to ensure your laptop is safe. It is ideal for 15"" Laptop.<br>', 'Warranty Type:Manufacturer, ; months manufacturing Warranty on Manufacturing Defects only.<br>', 'Compartment Description: Up To 15 Inches; Color Name: Navy,Black; Age Range Description: Adult; Water Resistance Level: Water Resistant; Style Name: Casual; Pattern Name: Solid<br>']"
https://www.amazon.in/Amazon-Brand-Backpack-15-6-inch-Laptops/dp/B076QFBFRG/ref=sr_1_221?crid=2M096C61O4MLT&keywords=bags&qid=1685155952&sprefix=ba%2Caps%2C283&sr=8-221,"Amazon Brand - Solimo Laptop Backpack for 15.6-inch Laptops (27 litres, Black) ",Rs.549,3.9 out of 5 stars,"1,322",Amazon Brand - Solimo,B076QFBFRG,"Amazon Brand - Solimo Laptop Backpack for 15.6-inch Laptops (27 litres, Black)","['Generous overall size of 32 x 15 x 44 cm (LxBxH)', '2 compartments, including a padded laptop compartment ideal for carrying laptops up to 15.6 inches', 'Bottle pockets on both sides for storing bottles, earphones, tickets and other smaller items', 'Made with wear-resistant Polyester material for a longer life', 'Reflectors on backpack promote visibility at night when on the road']"
https://www.amazon.in/Martucci-Waterproof-Backpack-College-Business/dp/B0BRJRVH6D/ref=sr_1_222?crid=2M096C61O4MLT&keywords=bags&qid=1685155952&sprefix=ba%2Caps%2C283&sr=8-222,Martucci Jersey 45L Casual Waterproof Laptop Backpack/Office Bag/School Bag/College Bag/Business Bag/Unisex Travel Backpack ,Rs.809,3.7 out of 5 stars,47,Martucci,B0BRJRVH6D,Martucci Jersey 45L Casual Waterproof Laptop Backpack/Office Bag/School Bag/College Bag/Business Bag/Unisex Travel Backpack,"['Durability & Design: 45L Laptop Backpack 2 Large Compartments, 1 Easy access front Pocket with1 Mesh Side Bottle Pocket and Phone Pocket. Fabric: Light weight polyester fabric with heavy zippers. Serves the need of a professional office laptop bag, college bag, student backpack, school bag and is suitable for all boys, girls, men and women.', 'FEATURES: Laptop Compartment (can carry laptops of size 15.6 & 18 inches),', 'Ergonomic Design: Thick cushioning around the shoulders and on the back panel makes the backpack super light and comfortable on the move. “S” Shaped shoulder strap distribute the weight of the backpack across your upper body.', 'FABRIC : Polyester, Closure Type: Zipper, Gender: Unisex Size: 20 inch X 14 inch X 8 inch.']"
https://www.amazon.in/Wildcraft-Polyester-Black-Laptop-8903338054290/dp/B012D4QKHW/ref=sr_1_223?crid=2M096C61O4MLT&keywords=bags&qid=1685155952&sprefix=ba%2Caps%2C283&sr=8-223,Wildcraft 44 cms Polyester Black Laptop Bag (8903338054290) ,"Rs.1,589",4.3 out of 5 stars,652,Wildcraft,B012D4QKHW,Wildcraft 44 cms Polyester Black Laptop Bag (8903338054290),"['Outer Material: Polyester, Color: Black', 'Water Resistance: Water resistant', 'Capacity: 20 ltrs; Weight: 0.35 kgs; Dimensions: 12.7 cms x 30.48 cms x 44.45 cms (LxWxH)', 'Number of compartments: 3', 'Laptop Compatibility: Yes, Size: 14 inches', 'Light Weight', 'Durable']"
https://www.amazon.in/Gear-DOUBLE-Resistant-Backpack-Navy-Tan/dp/B0BTJ2T26W/ref=sr_1_224?crid=2M096C61O4MLT&keywords=bags&qid=1685155952&sprefix=ba%2Caps%2C283&sr=8-224,Gear DOUBLE DECKER 31L Water Resistant Laptop Bag/Backpack/Office Bag for Men/Women (Navy-Tan) ,"Rs.1,482",4.0 out of 5 stars,1,Gear,B0BTJ2T26W,Gear DOUBLE DECKER 31L Water Resistant Laptop Bag/Backpack/Office Bag for Men/Women (Navy-Tan),"['Ergonomic Shape : Spacious Compartments : Intuitive Access : Water Resistant : Light-weight', 'Front Panel made of Premium Faux Leather Fabric : Cushioned Grab Handle : Padded Base : Optimized Back Panel with Premium Cushioning & Airflow Mechanism : Padded 360 Laptop Sleeve with Velcro Fastener Fits Laptop up to 17"" : Premium Long Lasting Zippers & Pullers : Compression Straps on the Sides for Keeping the Contents Compact', 'Zippered Quick Access Pocket : Elasticated Bottle Pocket : Embedded Organiser : Elasticated Trolley Sleeve on Back Panel']"
https://www.amazon.in/WildHorn-Leather-Messenger-MB205-Hunter/dp/B0795WK59N/ref=sr_1_225?crid=2M096C61O4MLT&keywords=bags&qid=1685155952&sprefix=ba%2Caps%2C283&sr=8-225,WildHorn® Leather 8.5 inch Sling Messenger Bag for Men I Multipurpose Crossbody Bag I Travel Bag with Adjustable Strap I DIMENSION: L- 8.5inch H- 10.5inch W- 3inch ,"Rs.1,919",4.1 out of 5 stars,748,WildHorn,B0795WK59N,WildHorn® Leather 8.5 inch Sling Messenger Bag for Men I Multipurpose Crossbody Bag I Travel Bag with Adjustable Strap I DIMENSION: L- 8.5inch H- 10.5inch W- 3inch,"['★★★★★ WARRANTY DETAILS :Genuine leather product can be used for many years. It is long lasting if it handled carefully. WILDHORN Offers 1 year warranty for the products against any manufacturing defect. Keep your Invoice safe, if you find any problem please contact with us. You can get fast replacement facility from WILDHORN.', '★★★★★ CUSTOMER AWARENESS: We present to you WildHorn Genuine Leather messenger bag. All our bags are 100% handmade from only the best materials. This bag acts as the perfect accessory to complete your look and make you stand out at an affordable price. This messenger bag has been made out of top grain genuine leather .100% customer satisfaction & fast and secure delivery.', '★★★★★ CRAFTMANSHIP, METAL FITTINGS AND REINFORCEMENT MATERIALS: Pure leather Bags get more beautiful on ageing. These are not PU which will contain shine on its surface. Start your journey now! Use this bag as a messenger bag, shoulder bag or laptop bag. Suitable for your school, office, college, university, meeting, and business for everyday use. It also makes for a great present. It is also most important to use good QUALITY Metal fittings and Reinforcement materials.', '★★★★★ PREMIUM HUNTER LEATHER :This is high quality classic genuine leather messenger bag from WildHorn. Featuring an elegant design, hand stitched, dyed and aged messenger bag is long-lasting, light weight and a fine quality genuine leather product. This WildHorn Casual Style Leather Messenger Bag features durable cotton fabric with rich leather, leather trim and an adjustable shoulder strap that can be slung comfortably across the body.', '★★★★★ MECHANISM:This messenger bag has main interior compartment with flap top closure for added security and a fully lined interior that includes zip pocket and slip pockets for organization. One rear zip pocket. The compartment has dedicated space for,I pad, tablet, phone & other small accessories. DIMENSION: L- 8.5inch H- 10.5inch W- 3inch']"
https://www.amazon.in/Girls-1518-Polyester-Designer-Waterproof-Bag-Backpack/dp/B08F9QYRZB/ref=sr_1_226?crid=2M096C61O4MLT&keywords=bags&qid=1685155952&sprefix=ba%2Caps%2C283&sr=8-226,Beauty Girls-1518 Polyester Floral printed Designer Stylish Waterproof School/Collage/Picknic Bag-Backpack For Girls & Women (32 Lit) ,Rs.798,4.4 out of 5 stars,"1,069",BEAUTY GIRLS,B08F9QYRZB,Beauty Girls-1518 Polyester Floral printed Designer Stylish Waterproof School/Collage/Picknic Bag-Backpack For Girls & Women (32 Lit),"['Comfortable adjustable padded shoulder straps that evenly distributes weight', 'MATERIAL & QUALITY:-Made from premium water resistant Polyester, Nylon, Plastic, Metal, Fabric provide strengthen and long-lasting performance', 'Adjustable Strap', 'Special Features: Radium strip on shoulder pad', '30 L Storage Capacity']"
https://www.amazon.in/Gear-Polyester-Laptop-Backpack-LBPECONO10412/dp/B012NW0J30/ref=sr_1_227?crid=2M096C61O4MLT&keywords=bags&qid=1685155952&sprefix=ba%2Caps%2C283&sr=8-227,Gear ECO1 24L Water Resistant Laptop Bag/Backpack/Office Bag for Men/Women- Grey-Black-Yellow ,Rs.759,4.2 out of 5 stars,"1,443",Gear,B012NW0J30,Gear ECO1 24L Water Resistant Laptop Bag/Backpack/Office Bag for Men/Women- Grey-Black-Yellow,"['Outer Material: Polyester, Color: Denim Grey', 'Capacity: 24 liters; Dimensions: 46 cms x 33 cms x 16 cms (LxWxH)', 'Number of Compartments: 3', 'Bottle holder mesh; Embedded organizer', 'Style Name: Traditional Backpacks; Pocket Description: Utility Pocket; Special Features: Back Padding; Water Resistance Level: Waterproof; Closure Type: Zipper; Pattern Name: Solid', 'Three main compartments', 'One front smaller compartment']"
https://www.amazon.in/POLICE-Stylish-Premium-Quality-Backpack/dp/B084Q4N84P/ref=sr_1_228?crid=2M096C61O4MLT&keywords=bags&qid=1685155952&sprefix=ba%2Caps%2C283&sr=8-228,POLICE Walt Laptop Backpack Business Office College Travel Bags for Men Fits Up to 15 inch Laptop Notebook - Black ,"Rs.1,689",4.1 out of 5 stars,647,POLICE,B084Q4N84P,POLICE Walt Laptop Backpack Business Office College Travel Bags for Men Fits Up to 15 inch Laptop Notebook - Black,"['Product Features: It is Lightweight and comfortable to carry with adjustable padded straps. This Backpack has decent capacity to store essentials with inside zipper pockets to put your private or valuable items. It also has Zipper closure for handy access. It is perfect for business, travelling, meeting, shopping and daily use.<br><br><br> <br>', 'Laptop Compatibility: Yes, Upto 15 inches<br><br><br> <br>', 'Warranty Type: Manufacturer , 6 months manufacturer warranty on manufacturing defects only.<br><br><br> <br>', 'Age Range Description: Adult; Special Features: Back Padding<br><br>; Compartment Description: Up To 15 Inches<br> <br>', 'Pattern Name: Solid <br>']"
https://www.amazon.in/sspa/click?ie=UTF8&spc=MTo2MDU1NTUyMzQ2NjE0NjYwOjE2ODUxNTU5NTI6c3BfYnRmOjIwMDYzNzg0NDU4Mjk4OjowOjo&url=%2Fuppercase-Backpack-1600EBP1-repellent-sustainable%2Fdp%2FB0B5N9TY9C%2Fref%3Dsr_1_229_sspa%3Fcrid%3D2M096C61O4MLT%26keywords%3Dbags%26qid%3D1685155952%26sprefix%3Dba%252Caps%252C283%26sr%3D8-229-spons%26sp_csd%3Dd2lkZ2V0TmFtZT1zcF9idGY%26psc%3D1,"uppercase Laptop Backpack 1600EBP Compact 3x more water repellent sustainable bags with rain proof zippers for Men, Women, Boys and Girls, 750 Days warranty ","Rs.1,100",4.2 out of 5 stars,198,uppercase,B0B5N9TY9C,"uppercase Laptop Backpack 1600EBP Compact 3x more water repellent sustainable bags with rain proof zippers for Men, Women, Boys and Girls, 750 Days warranty","['Padded laptop compartment fits up to 14 inch laptop, Front Access pocket & Back padding with Air mesh']"
https://www.amazon.in/sspa/click?ie=UTF8&spc=MTo2MDU1NTUyMzQ2NjE0NjYwOjE2ODUxNTU5NTI6c3BfYnRmOjIwMTU5Njk3MzQxMTk4OjowOjo&url=%2FElegant-Vertical-Waterproof-Backpack-Green%2Fdp%2FB0C5T2D8QM%2Fref%3Dsr_1_230_sspa%3Fcrid%3D2M096C61O4MLT%26keywords%3Dbags%26qid%3D1685155952%26sprefix%3Dba%252Caps%252C283%26sr%3D8-230-spons%26sp_csd%3Dd2lkZ2V0TmFtZT1zcF9idGY%26psc%3D1,Elegant Sports Vertical (16 inch 28 L Casual Waterproof Laptop Backpack/Office Bag/School Bag/College Bag/Business Bag/Unisex Travel Backpack (Black/Green) ,Rs.899,,,Elegant,B0C5T2D8QM,Elegant Sports Vertical (16 inch 28 L Casual Waterproof Laptop Backpack/Office Bag/School Bag/College Bag/Business Bag/Unisex Travel Backpack (Black/Green),"['Dimensions and Capacity]: (48 Cm X 33 Cm X 28 CM) 28 Liters. Compatible upto 16\xa0Inches\xa0Laptop.', 'Easy Access Pockets: A sleek anti-theft pocket on the back as well as 2 pockets on the front side help keep all your belongings comfortably organized.', 'Two Large Compartment: It comes with two large compartments with separate padded laptop compartment with elastic bands to hold the laptop.', 'Ergonomic Design: The backpack features a sleek and ergonomic design with a balanced weight distribution through its straps to reduce the load bearing on your shoulders while the padded ventilated air mesh helps reduce sweat. This makes this backpack a suitable alternative to bulky and unsightly laptop backpacks', 'Waterproof Fabric: The backpack comes with a superior waterproof fabric which helps in keeping your laptop and other important stuff\xa0safe\xa0from\xa0rain']"
https://www.amazon.in/sspa/click?ie=UTF8&spc=MTo3MTU4NDM2ODkyODY3NDY5OjE2ODUxNTYxMzQ6c3BfYXRmX25leHQ6MjAxMjk1ODY4NjUyOTg6OjA6Og&url=%2FBLUFIN-Unisex-Laptop-Backpack-Large%2Fdp%2FB09TRZ9CL2%2Fref%3Dsr_1_225_sspa%3Fcrid%3D2M096C61O4MLT%26keywords%3Dbags%26qid%3D1685156134%26sprefix%3Dba%252Caps%252C283%26sr%3D8-225-spons%26sp_csd%3Dd2lkZ2V0TmFtZT1zcF9hdGZfbmV4dA%26psc%3D1,BLUFIN Large 45L Laptop Backpack Unisex Backpack |School Bag| |College Bag Bags ,Rs.699,3.9 out of 5 stars,56,BLUFIN,B09TRZ9CL2,BLUFIN Large 45L Laptop Backpack Unisex Backpack |School Bag| |College Bag Bags,"['school bag<br><br>', 'backpack<br><br>', 'college bag<br><br>', 'Style Name: Casual; Water Resistance Level: Water Resistant; Strap Type: Cross-Body; Closure Type: Zipper; Age Range Description: Big Kid; Special Features: Laptop Compartment; Pattern Name: Solid<br>', '<br>']"
https://www.amazon.in/sspa/click?ie=UTF8&spc=MTo3MTU4NDM2ODkyODY3NDY5OjE2ODUxNTYxMzQ6c3BfYXRmX25leHQ6MjAxNTE4NjA4MzM0OTg6OjA6Og&url=%2FKenneth-Cole-Reaction-Polyester-Backpack%2Fdp%2FB07GX3PWNK%2Fref%3Dsr_1_226_sspa%3Fcrid%3D2M096C61O4MLT%26keywords%3Dbags%26qid%3D1685156134%26sprefix%3Dba%252Caps%252C283%26sr%3D8-226-spons%26sp_csd%3Dd2lkZ2V0TmFtZT1zcF9hdGZfbmV4dA%26psc%3D1,"Kenneth Cole Reaction Women's Chevron Quilted Polyester Twill 15.6"" Laptop Backpack, Midnight Black, One Size ","Rs.3,275",4.8 out of 5 stars,237,Kenneth Cole Reaction,B07GX3PWNK,"Kenneth Cole Reaction Women's Chevron Quilted Polyester Twill 15.6"" Laptop Backpack, Midnight Black, One Size","['Imported', 'polyester lining', '155"" shoulder drop', '155"" high; 1125"" wide; Pockets: 7 slip, 2 zip, 4 exterior']"
https://www.amazon.in/POLICE-Stylish-Premium-Quality-Backpack/dp/B084Q4N84P/ref=sr_1_227?crid=2M096C61O4MLT&keywords=bags&qid=1685156134&sprefix=ba%2Caps%2C283&sr=8-227,POLICE Walt Laptop Backpack Business Office College Travel Bags for Men Fits Up to 15 inch Laptop Notebook - Black ,"Rs.1,689",4.1 out of 5 stars,647,POLICE,B084Q4N84P,POLICE Walt Laptop Backpack Business Office College Travel Bags for Men Fits Up to 15 inch Laptop Notebook - Black,"['Product Features: It is Lightweight and comfortable to carry with adjustable padded straps. This Backpack has decent capacity to store essentials with inside zipper pockets to put your private or valuable items. It also has Zipper closure for handy access. It is perfect for business, travelling, meeting, shopping and daily use.<br><br><br> <br>', 'Laptop Compatibility: Yes, Upto 15 inches<br><br><br> <br>', 'Warranty Type: Manufacturer , 6 months manufacturer warranty on manufacturing defects only.<br><br><br> <br>', 'Age Range Description: Adult; Special Features: Back Padding<br><br>; Compartment Description: Up To 15 Inches<br> <br>', 'Pattern Name: Solid <br>']"
https://www.amazon.in/Puma-Unisex-Adult-Backpack-Fizzy-9018404/dp/B0BWF2BNBP/ref=sr_1_228?crid=2M096C61O4MLT&keywords=bags&qid=1685156134&sprefix=ba%2Caps%2C283&sr=8-228,"Puma Unisex-Adult Big Cat Backpack, Fizzy Apple (9018404) ",Rs.999,,,Puma,B0BWF2BNBP,"Puma Unisex-Adult Big Cat Backpack, Fizzy Apple (9018404)","['Care Instructions: Hand Wash Only', 'Style Name:-Backpack', 'Model Name:-Big Cat Backpack', 'Brand Color:-Fizzy Apple', 'Material:-Polyester', 'Dimension:- 47 x 32 x 20 cm (26L)']"
https://www.amazon.in/F-Gear-Millionaire-Doby-Black-Laptop-Backpack/dp/B07XMLCYTH/ref=sr_1_229?crid=2M096C61O4MLT&keywords=bags&qid=1685156134&sprefix=ba%2Caps%2C283&sr=8-229,F Gear Millionaire Doby 36 Ltrs Black Laptop Backpack (3201) ,"Rs.1,049",4.1 out of 5 stars,35,F Gear,B07XMLCYTH,F Gear Millionaire Doby 36 Ltrs Black Laptop Backpack (3201),"['Outer Material: Polyester, Color: Black', 'Waterproof', 'Capacity: 36 liters; Weight: 950 grams; Dimensions: 35 cms x 23 cms x 48 cms (LxWxH)', 'Number of Wheels: 0, Number of compartments: 2', 'Laptop Compatibility: Yes, Laptop Size: 17 inchesStrap Type: Adjustable', 'Warranty type: Manufacturer; 1 year manufacturer warranty is non-transferable and valid for 1 year from the original date of purchase', 'Hidden Secret Pocket at back']"
https://www.amazon.in/F-Gear-Fortune-Backpack-Navy-Blue/dp/B07B7K7212/ref=sr_1_230?crid=2M096C61O4MLT&keywords=bags&qid=1685156134&sprefix=ba%2Caps%2C283&sr=8-230,"F Gear Fortune Navy Blue, Red 27 Liters Laptop Backpack (2700) ",Rs.884,4.1 out of 5 stars,497,F Gear,B07B7K7212,"F Gear Fortune Navy Blue, Red 27 Liters Laptop Backpack (2700)","['Either Trekking bag or Backpack, Dual loops for holding ice axes', 'Large zippered main compartment with laptop sleeve up to 16 inches', 'Adjustable straps fit perfectly over the shoulders', 'Size-(LxHxW) Cm-(27x49x21) Cm', 'It comes with the F Gear promise of quality. Note: There might be minor color variation between actual product and image shown on screen due to lighting on the photography']"
https://www.amazon.in/COSMUS-Multipurpose-Backpack-Bag-compartment/dp/B078JVT384/ref=sr_1_231?crid=2M096C61O4MLT&keywords=bags&qid=1685156134&sprefix=ba%2Caps%2C283&sr=8-231,"COSMUS Madison waterproof Multipurpose Backpack With laptop compartment , 33L ","Rs.1,420",4.2 out of 5 stars,"2,231",COSMUS,B078JVT384,"COSMUS Madison waterproof Multipurpose Backpack With laptop compartment , 33L","['Care Instructions: Hand Wash Only', 'Large multi-compartment backpack with a padded sleeve for laptops, Holds up to 15 inches Laptop<br> <br>', 'Water Resistance PU Coated Durable Fabric, with padded back section for comfortable carry<br> <br>', 'Front Organizer compartments for pens, keys, and cell phone<br> <br>', 'Age Range Description: Adult; Strap Type: Cross-Body; Warranty Description: Warranty: 1 Year Warranty Against Manufacturing Defects.; Pattern Name: Solid; Closure Type: Zipper; Water Resistance Level: Water Resistant; Pocket Description: Utility Pocket <br>']"
